{
  "schema": "pids-nexus/typedict/v1",
  "domain": "er-eap",
  "label": "员工关系/EAP",
  "source_standard": "Frictionless Table Schema v1 + JSON Schema 2020-12",
  "fields": [
    {
      "id": "eap_referrals.csv:anon_id",
      "entity": "eap_referrals.csv",
      "field": "anon_id",
      "physical_type": "csv",
      "logical_type": "string",
      "format": null,
      "semantic_type": "identifier",
      "unit": "",
      "nullable": false,
      "enum_values": [],
      "constraints": [],
      "example": "EAP-ANON-0731",
      "foreign_key": null,
      "required": true,
      "source": "er-eap/eap_referrals.csv",
      "pii": false,
      "level": "L4",
      "description": "匿名转介编号，主键，形如 `EAP-ANON-XXXX`；与真实身份的映射表分离存放于 EAP 独立命名空间，工作台内不可反查",
      "lineage": {
        "upstream": [
          "dataset:er-eap/eap_referrals.csv",
          "field:anon_id"
        ],
        "downstream": []
      },
      "used_by_workflows": []
    },
    {
      "id": "eap_referrals.csv:approval_specialist",
      "entity": "eap_referrals.csv",
      "field": "approval_specialist",
      "physical_type": "csv",
      "logical_type": "array",
      "format": null,
      "semantic_type": "attribute",
      "unit": "",
      "nullable": false,
      "enum_values": [],
      "constraints": [],
      "example": "已通过",
      "foreign_key": null,
      "required": true,
      "source": "er-eap/eap_referrals.csv",
      "pii": false,
      "level": "L4",
      "description": "EAP 专员侧审批机读值：已通过 / 待审批 / 已驳回",
      "lineage": {
        "upstream": [
          "dataset:er-eap/eap_referrals.csv",
          "field:approval_specialist"
        ],
        "downstream": []
      },
      "used_by_workflows": []
    },
    {
      "id": "eap_referrals.csv:approval_supervisor",
      "entity": "eap_referrals.csv",
      "field": "approval_supervisor",
      "physical_type": "csv",
      "logical_type": "string",
      "format": null,
      "semantic_type": "attribute",
      "unit": "",
      "nullable": false,
      "enum_values": [],
      "constraints": [],
      "example": "已通过",
      "foreign_key": null,
      "required": true,
      "source": "er-eap/eap_referrals.csv",
      "pii": false,
      "level": "L4",
      "description": "主管侧审批机读值：已通过 / 待审批 / 已驳回（`approvals` 的拆分列，供门禁机检）",
      "lineage": {
        "upstream": [
          "dataset:er-eap/eap_referrals.csv",
          "field:approval_supervisor"
        ],
        "downstream": []
      },
      "used_by_workflows": []
    },
    {
      "id": "eap_referrals.csv:approvals",
      "entity": "eap_referrals.csv",
      "field": "approvals",
      "physical_type": "csv",
      "logical_type": "array",
      "format": null,
      "semantic_type": "attribute",
      "unit": "",
      "nullable": false,
      "enum_values": [],
      "constraints": [],
      "example": "主管✓/专员✓",
      "foreign_key": null,
      "required": true,
      "source": "er-eap/eap_referrals.csv",
      "pii": false,
      "level": "L4",
      "description": "双审批展示口径：`主管✓/专员✓`（已通过）、`主管待/专员待`（待审批）、`主管✓/专员✗`（已驳回）",
      "lineage": {
        "upstream": [
          "dataset:er-eap/eap_referrals.csv",
          "field:approvals"
        ],
        "downstream": []
      },
      "used_by_workflows": []
    },
    {
      "id": "eap_referrals.csv:direction",
      "entity": "eap_referrals.csv",
      "field": "direction",
      "physical_type": "csv",
      "logical_type": "string",
      "format": null,
      "semantic_type": "attribute",
      "unit": "",
      "nullable": false,
      "enum_values": [
        "心理咨询(外部机构)",
        "法律援助(劳动咨询)",
        "心理咨询(内部)",
        "危机干预",
        "健康管理(外部机构)",
        "家庭与照护(外部机构)",
        "职业发展咨询(内部)"
      ],
      "constraints": [],
      "example": "心理咨询(外部机构)",
      "foreign_key": null,
      "required": true,
      "source": "er-eap/eap_referrals.csv",
      "pii": false,
      "level": "L4",
      "description": "转介方向（**类别标签**，禁写内容/机构实名/人名）：心理咨询(外部机构) / 心理咨询(内部) / 法律援助(劳动咨询) / 危机干预 / 健康管理(外部机构) / 家庭与照护(外部机构) / 职业发展咨询(内部)",
      "lineage": {
        "upstream": [
          "dataset:er-eap/eap_referrals.csv",
          "field:direction"
        ],
        "downstream": []
      },
      "used_by_workflows": []
    },
    {
      "id": "eap_referrals.csv:referral_month",
      "entity": "eap_referrals.csv",
      "field": "referral_month",
      "physical_type": "csv",
      "logical_type": "string",
      "format": null,
      "semantic_type": "temporal",
      "unit": "",
      "nullable": false,
      "enum_values": [],
      "constraints": [],
      "example": "2026-07",
      "foreign_key": null,
      "required": true,
      "source": "er-eap/eap_referrals.csv",
      "pii": false,
      "level": "L4",
      "description": "转介受理月份 YYYY-MM（供匿名月报聚合，不落具体日）",
      "lineage": {
        "upstream": [
          "dataset:er-eap/eap_referrals.csv",
          "field:referral_month"
        ],
        "downstream": []
      },
      "used_by_workflows": []
    },
    {
      "id": "eap_referrals.csv:sessions_left",
      "entity": "eap_referrals.csv",
      "field": "sessions_left",
      "physical_type": "csv",
      "logical_type": "integer",
      "format": null,
      "semantic_type": "attribute",
      "unit": "",
      "nullable": false,
      "enum_values": [],
      "constraints": [
        {
          "kind": "minimum",
          "value": 0
        },
        {
          "kind": "maximum",
          "value": 10
        }
      ],
      "example": "5",
      "foreign_key": null,
      "required": true,
      "source": "er-eap/eap_referrals.csv",
      "pii": false,
      "level": "L4",
      "description": "剩余会话额度（≥0）；待双审批行未核销，通过后方可使用",
      "lineage": {
        "upstream": [
          "dataset:er-eap/eap_referrals.csv",
          "field:sessions_left"
        ],
        "downstream": []
      },
      "used_by_workflows": []
    },
    {
      "id": "eap_referrals.csv:sessions_used",
      "entity": "eap_referrals.csv",
      "field": "sessions_used",
      "physical_type": "csv",
      "logical_type": "integer",
      "format": null,
      "semantic_type": "attribute",
      "unit": "",
      "nullable": false,
      "enum_values": [],
      "constraints": [
        {
          "kind": "minimum",
          "value": 0
        },
        {
          "kind": "maximum",
          "value": 12
        }
      ],
      "example": "7",
      "foreign_key": null,
      "required": true,
      "source": "er-eap/eap_referrals.csv",
      "pii": false,
      "level": "L4",
      "description": "已消耗会话次数（≥0）；`status=待双审批/已驳回` 时必须为 0（见 §9 R2）",
      "lineage": {
        "upstream": [
          "dataset:er-eap/eap_referrals.csv",
          "field:sessions_used"
        ],
        "downstream": []
      },
      "used_by_workflows": []
    },
    {
      "id": "eap_referrals.csv:status",
      "entity": "eap_referrals.csv",
      "field": "status",
      "physical_type": "csv",
      "logical_type": "string",
      "format": null,
      "semantic_type": "categorical",
      "unit": "",
      "nullable": false,
      "enum_values": [
        "进行中",
        "已结案",
        "待双审批",
        "已驳回"
      ],
      "constraints": [],
      "example": "进行中",
      "foreign_key": null,
      "required": true,
      "source": "er-eap/eap_referrals.csv",
      "pii": false,
      "level": "L4",
      "description": "转介状态：待双审批 / 进行中 / 已结案 / 已驳回（见 §4.3）",
      "lineage": {
        "upstream": [
          "dataset:er-eap/eap_referrals.csv",
          "field:status"
        ],
        "downstream": []
      },
      "used_by_workflows": []
    },
    {
      "id": "eap_referrals.csv:status_date",
      "entity": "eap_referrals.csv",
      "field": "status_date",
      "physical_type": "csv",
      "logical_type": "string",
      "format": "date",
      "semantic_type": "temporal",
      "unit": "",
      "nullable": false,
      "enum_values": [],
      "constraints": [],
      "example": "2026-09-12",
      "foreign_key": null,
      "required": true,
      "source": "er-eap/eap_referrals.csv",
      "pii": false,
      "level": "L4",
      "description": "当前状态更新日 YYYY-MM-DD（状态迁移留痕）",
      "lineage": {
        "upstream": [
          "dataset:er-eap/eap_referrals.csv",
          "field:status_date"
        ],
        "downstream": []
      },
      "used_by_workflows": []
    },
    {
      "id": "er_cases.csv:asset_release_status",
      "entity": "er_cases.csv",
      "field": "asset_release_status",
      "physical_type": "csv",
      "logical_type": "string",
      "format": null,
      "semantic_type": "categorical",
      "unit": "",
      "nullable": false,
      "enum_values": [
        "不涉及",
        "待释放",
        "已释放"
      ],
      "constraints": [],
      "example": "不涉及",
      "foreign_key": null,
      "required": true,
      "source": "er-eap/er_cases.csv",
      "pii": false,
      "level": "L4",
      "description": "名下资产释放状态：不涉及 / 待释放 / 已释放（离职完成联动 ADMIN 域置\"已释放\"）",
      "lineage": {
        "upstream": [
          "dataset:er-eap/er_cases.csv",
          "field:asset_release_status"
        ],
        "downstream": []
      },
      "used_by_workflows": []
    },
    {
      "id": "er_cases.csv:case_date",
      "entity": "er_cases.csv",
      "field": "case_date",
      "physical_type": "csv",
      "logical_type": "string",
      "format": "date",
      "semantic_type": "temporal",
      "unit": "",
      "nullable": false,
      "enum_values": [],
      "constraints": [],
      "example": "2026-08-18",
      "foreign_key": null,
      "required": true,
      "source": "er-eap/er_cases.csv",
      "pii": false,
      "level": "L4",
      "description": "案件登记日 YYYY-MM-DD",
      "lineage": {
        "upstream": [
          "dataset:er-eap/er_cases.csv",
          "field:case_date"
        ],
        "downstream": []
      },
      "used_by_workflows": []
    },
    {
      "id": "er_cases.csv:case_id",
      "entity": "er_cases.csv",